{
  "novel_id": "nov_EUubI",
  "created_at": "2026-08-27T12:00:00Z",
  "title": "最小故事",
  "language": "zh-Hant",
  "main_characters": [
    "洛恩",
    "艾莉婭",
    "塞拉斯",
    "伊瑟琳",
    "阿斯塔羅"
  ],
  "zombie_count": 0,
  "tnt_cannon_count": 0,
  "expected_han_characters": 4,
  "chapters": [
    {
      "title": "第一章",
      "text": "春風到了。"
    }
  ]
}
